{
  "schema_version": "experience-surface-activation-request-v0",
  "request_id": "preflight.actual-storage.0001",
  "requested_surface": "actual_experience_storage",
  "requested_operation": "enable_actual_experience_storage",
  "objective_item": 8,
  "requested_domains": ["career_private", "place_service_experience"],
  "requested_enablement": {
    "real_data_ingest_enabled": true,
    "public_serving_enabled": false,
    "b2b_delivery_enabled": false,
    "identity_processing_enabled": false,
    "raw_detail_escrow_enabled": false,
    "dashboard_enabled": false
  },
  "gate_evidence": [
    {"gate": "PR-003", "status": "draft", "evidence_ref": "fixtures/consent-revocation-gate.draft.json"},
    {"gate": "PR-006", "status": "draft", "evidence_ref": "fixtures/intake-safety-gate.draft.json"},
    {"gate": "ED-001", "status": "passed", "evidence_ref": "fixtures/domain-policy-registry.draft.json"},
    {"gate": "ED-002", "status": "passed", "evidence_ref": "fixtures/candidate-payload-facets.technical-work.sample.json"}
  ],
  "output_contract": {
    "requested_outputs": ["redacted_subject_name", "redacted_experience_summary"],
    "allowed_outputs": ["redacted_subject_name", "redacted_experience_summary"],
    "redaction_profile": "career_private_redacted",
    "no_raw_identity_output": true,
    "no_raw_source_output": true
  },
  "preflight_effect": {
    "command_effect": "preflight_only",
    "writes_real_data": false,
    "creates_card": false,
    "indexes": false,
    "opens_public_surface": false,
    "performs_identity_processing": false,
    "stores_raw_detail": false,
    "serves_dashboard": false
  }
}
